{
  "email_id": "email_324",
  "declared_role": "SI",
  "source_path": "attachments/email_324_SI.txt",
  "format": "txt",
  "detected_doc_type": "SI",
  "parse_status": "ok",
  "fields": {
    "shipper": {
      "present": true,
      "label_seen": "Shipper",
      "raw": "ASIA PACIFIC PAPERBOARD TRADING PTE LTD"
    },
    "consignee": {
      "present": true,
      "label_seen": "Consignee",
      "raw": "CLIFFORD PAPER INC"
    },
    "notify_party": {
      "present": true,
      "label_seen": "NOTIFY PARTY",
      "raw": "CLIFFORD PAPER INC"
    },
    "port_of_loading": {
      "present": true,
      "label_seen": "POL",
      "raw": "BUATAN, INDONESIA (IDBUA)"
    },
    "port_of_discharge": {
      "present": true,
      "label_seen": "Port of Discharge",
      "raw": "NEW YORK, US (USNYC)"
    },
    "container_count": {
      "present": true,
      "label_seen": "No. of Containers",
      "raw": "3 x 40'HC"
    },
    "gross_weight_kg": {
      "present": true,
      "label_seen": "Gross Weight (KG)",
      "raw": "60,258 KG"
    }
  }
}