{
  "email_id": "email_044",
  "declared_role": "BL",
  "source_path": "attachments/email_044_BL.txt",
  "format": "txt",
  "detected_doc_type": "BL",
  "parse_status": "ok",
  "fields": {
    "shipper": {
      "present": true,
      "label_seen": "Shipper/Exporter",
      "raw": "APRIL FINE PAPER TRADING"
    },
    "consignee": {
      "present": true,
      "label_seen": "CONSIGNEE",
      "raw": "SAFQA LIMITED"
    },
    "notify_party": {
      "present": true,
      "label_seen": "Notify Party",
      "raw": "SAFQA LIMITED"
    },
    "port_of_loading": {
      "present": true,
      "label_seen": "Port of Loading",
      "raw": "BUATAN, INDONESIA (IDBUA)"
    },
    "port_of_discharge": {
      "present": true,
      "label_seen": "Port of Discharge",
      "raw": "APAPA, NIGERIA (NGAPP)"
    },
    "container_count": {
      "present": true,
      "label_seen": "No. of Containers",
      "raw": "2 x 40'HC"
    },
    "gross_weight_kg": {
      "present": true,
      "label_seen": "Gross Weight毛重(KGS)",
      "raw": "47,192 KG"
    }
  }
}