{
  "email_id": "email_428",
  "declared_role": "BL",
  "source_path": "attachments/email_428_BL.txt",
  "format": "txt",
  "detected_doc_type": "BL",
  "parse_status": "ok",
  "fields": {
    "shipper": {
      "present": true,
      "label_seen": "SHIPPER",
      "raw": "APRIL FINE PAPER TRADING"
    },
    "consignee": {
      "present": true,
      "label_seen": "CONSIGNEE",
      "raw": "HABRAS INTERNATIONAL LIMITED"
    },
    "notify_party": {
      "present": true,
      "label_seen": "Notify Party",
      "raw": "HABRAS INTERNATIONAL LIMITED"
    },
    "port_of_loading": {
      "present": true,
      "label_seen": "POL",
      "raw": "PORT KLANG (WESTPORT), MALAYSIA (MYPKG)"
    },
    "port_of_discharge": {
      "present": true,
      "label_seen": "Discharge Port",
      "raw": "FREMANTLE, AUSTRALIA (AUFRE)"
    },
    "container_count": {
      "present": true,
      "label_seen": "Total Containers",
      "raw": "4 x 20'GP"
    },
    "gross_weight_kg": {
      "present": true,
      "label_seen": "Gross Wt (kgs)",
      "raw": "88,308 KG"
    }
  }
}