{
  "email_id": "email_032",
  "declared_role": "SI",
  "source_path": "attachments/email_032_SI.txt",
  "format": "txt",
  "detected_doc_type": "SI",
  "parse_status": "ok",
  "fields": {
    "shipper": {
      "present": true,
      "label_seen": "Shipper/Exporter",
      "raw": "APRIL FAR EAST (M) SDN BHD"
    },
    "consignee": {
      "present": true,
      "label_seen": "Consignee (Non-Negotiable)",
      "raw": "TOPKOPY MIDDLE EAST FZE"
    },
    "notify_party": {
      "present": true,
      "label_seen": "Notify Party",
      "raw": "TOPKOPY MIDDLE EAST FZE"
    },
    "port_of_loading": {
      "present": true,
      "label_seen": "Port of Loading (POL)",
      "raw": "RUGAO/NANTONG/SHANGHAI, CHINA (CNSHA)"
    },
    "port_of_discharge": {
      "present": true,
      "label_seen": "Discharge Port",
      "raw": "KARACHI, PAKISTAN (PKKHI)"
    },
    "container_count": {
      "present": true,
      "label_seen": "Total Containers",
      "raw": "3 x 40'HC"
    },
    "gross_weight_kg": {
      "present": true,
      "label_seen": "Gross Wt (kgs)",
      "raw": "64,092 KG"
    }
  }
}