{
  "email_id": "email_059",
  "declared_role": "SI",
  "source_path": "attachments/email_059_SI.pdf",
  "format": "pdf",
  "detected_doc_type": "SI",
  "parse_status": "ok",
  "fields": {
    "shipper": {
      "present": true,
      "label_seen": "Shipper",
      "raw": "APRIL FINE PAPER TRADING"
    },
    "consignee": {
      "present": true,
      "label_seen": "Consignee",
      "raw": "BALL & DOGGETT AUSTRALIA PTY LTD"
    },
    "notify_party": {
      "present": true,
      "label_seen": "Notify Party",
      "raw": "PACIFIC OFFICE (M) SDN BHD"
    },
    "port_of_loading": {
      "present": true,
      "label_seen": "POL",
      "raw": "BUATAN, INDONESIA"
    },
    "port_of_discharge": {
      "present": true,
      "label_seen": "Port of Discharge (POD)",
      "raw": "FREMANTLE, AUSTRALIA"
    },
    "container_count": {
      "present": true,
      "label_seen": "No. of Containers",
      "raw": "6 x 40'HC"
    },
    "gross_weight_kg": {
      "present": true,
      "label_seen": "TOTAL Gross Wt (kgs)",
      "raw": "131,322 KG"
    }
  }
}