{
  "email_id": "email_313",
  "declared_role": "SI",
  "source_path": "attachments/email_313_SI.pdf",
  "format": "pdf",
  "detected_doc_type": "SI",
  "parse_status": "ok",
  "fields": {
    "shipper": {
      "present": true,
      "label_seen": "Shipper/Exporter",
      "raw": "APRIL FINE PAPER TRADING"
    },
    "consignee": {
      "present": true,
      "label_seen": "To the Order of",
      "raw": "KPP-ANTALIS (SINGAPORE) PTE. LTD."
    },
    "notify_party": {
      "present": true,
      "label_seen": "NOTIFY PARTY",
      "raw": "KPP-ANTALIS (SINGAPORE) PTE. LTD."
    },
    "port_of_loading": {
      "present": true,
      "label_seen": "Load Port",
      "raw": "RUGAO/NANTONG/SHANGHAI, CHINA"
    },
    "port_of_discharge": {
      "present": true,
      "label_seen": "Port of Discharge",
      "raw": "HOCHIMINH CITY, VIETNAM"
    },
    "container_count": {
      "present": true,
      "label_seen": "Total Containers",
      "raw": "5 x 40'HC"
    },
    "gross_weight_kg": {
      "present": true,
      "label_seen": "TOTAL GROSS WEIGHT",
      "raw": "118,270 KG"
    }
  }
}