{
  "email_id": "email_071",
  "declared_role": "BL",
  "source_path": "attachments/email_071_BL.txt",
  "format": "txt",
  "detected_doc_type": "BL",
  "parse_status": "ok",
  "fields": {
    "shipper": {
      "present": true,
      "label_seen": "Shipper (Principal or Seller)",
      "raw": "APRIL FAR EAST (M) SDN BHD"
    },
    "consignee": {
      "present": true,
      "label_seen": "Consignee",
      "raw": "HABRAS INTERNATIONAL LIMITED"
    },
    "notify_party": {
      "present": true,
      "label_seen": "NOTIFY PARTY",
      "raw": "HABRAS INTERNATIONAL LIMITED"
    },
    "port_of_loading": {
      "present": true,
      "label_seen": "Load Port",
      "raw": "PORT KLANG (WESTPORT), MALAYSIA (MYPKG)"
    },
    "port_of_discharge": {
      "present": true,
      "label_seen": "Discharge Port",
      "raw": "CEBU, PHILIPPINES (MMRGN)"
    },
    "container_count": {
      "present": true,
      "label_seen": "No. of Containers",
      "raw": "8 x 40'HC"
    },
    "gross_weight_kg": {
      "present": true,
      "label_seen": "GROSS WEIGHT",
      "raw": "132,006 KG"
    }
  }
}