{
  "email_id": "email_225",
  "declared_role": "BL",
  "source_path": "attachments/email_225_BL.txt",
  "format": "txt",
  "detected_doc_type": "BL",
  "parse_status": "ok",
  "fields": {
    "shipper": {
      "present": true,
      "label_seen": "Shipper",
      "raw": "ASIA PACIFIC PAPERBOARD TRADING PTE LTD"
    },
    "consignee": {
      "present": true,
      "label_seen": "CONSIGNEE",
      "raw": "AL GURG STATIONERY LLC"
    },
    "notify_party": {
      "present": true,
      "label_seen": "Notify Party/Intermediate Consignee",
      "raw": "TOAN LUC PAPER JOINT STOCK COMPANY"
    },
    "port_of_loading": {
      "present": true,
      "label_seen": "PORT OF LOADING",
      "raw": "PORT KLANG (WESTPORT), MALAYSIA (MYPKG)"
    },
    "port_of_discharge": {
      "present": true,
      "label_seen": "Port of Discharge (POD)",
      "raw": "GDANSK, POLAND (PLGDN)"
    },
    "container_count": {
      "present": true,
      "label_seen": "No. of Containers",
      "raw": "1 x 40'HC"
    },
    "gross_weight_kg": {
      "present": true,
      "label_seen": "GROSS WEIGHT",
      "raw": "22,596 KG"
    }
  }
}