{
  "email_id": "email_516",
  "declared_role": "BL",
  "source_path": "attachments/email_516_BL.txt",
  "format": "txt",
  "detected_doc_type": "BL",
  "parse_status": "ok",
  "fields": {
    "shipper": {
      "present": true,
      "label_seen": "Shipper",
      "raw": "APRIL FINE PAPER TRADING"
    },
    "consignee": {
      "present": true,
      "label_seen": "Consignee",
      "raw": "KPP-ANTALIS (SINGAPORE) PTE. LTD."
    },
    "notify_party": {
      "present": true,
      "label_seen": "Notify Party/Intermediate Consignee",
      "raw": "KPP-ANTALIS (SINGAPORE) PTE. LTD."
    },
    "port_of_loading": {
      "present": true,
      "label_seen": "Load Port",
      "raw": "NHAVA SHEVA, INDIA (INNSA)"
    },
    "port_of_discharge": {
      "present": true,
      "label_seen": "POD",
      "raw": "CONAKRY, GUINEA (GNCKY)"
    },
    "container_count": {
      "present": true,
      "label_seen": "Container Count",
      "raw": "10 x 20'FCL"
    },
    "gross_weight_kg": {
      "present": true,
      "label_seen": "Gross Weight (KG)",
      "raw": "235,550 KG"
    }
  }
}