{
  "email_id": "email_410",
  "declared_role": "BL",
  "source_path": "attachments/email_410_BL.txt",
  "format": "txt",
  "detected_doc_type": "BL",
  "parse_status": "ok",
  "fields": {
    "shipper": {
      "present": true,
      "label_seen": "Shipper (Principal or Seller)",
      "raw": "APRIL FINE PAPER TRADING (MIDDLE EAST) FZE"
    },
    "consignee": {
      "present": true,
      "label_seen": "Consignee",
      "raw": "PACIFIC OFFICE (M) SDN BHD"
    },
    "notify_party": {
      "present": true,
      "label_seen": "NOTIFY PARTY",
      "raw": "PACIFIC OFFICE (M) SDN BHD"
    },
    "port_of_loading": {
      "present": true,
      "label_seen": "Port of Loading",
      "raw": "PORT KLANG (WESTPORT), MALAYSIA (SGSIN)"
    },
    "port_of_discharge": {
      "present": true,
      "label_seen": "Port of Discharge (POD)",
      "raw": "ASHDOD, ISRAEL (ILASH)"
    },
    "container_count": {
      "present": true,
      "label_seen": "Total Containers",
      "raw": "15 x 40'HC"
    },
    "gross_weight_kg": {
      "present": true,
      "label_seen": "GROSS WEIGHT",
      "raw": "324,210 KG"
    }
  }
}