{
  "email_id": "email_518",
  "declared_role": "SI",
  "source_path": "attachments/email_518_SI.txt",
  "format": "txt",
  "detected_doc_type": "SI",
  "parse_status": "ok",
  "fields": {
    "shipper": {
      "present": true,
      "label_seen": "Shipper (Principal or Seller)",
      "raw": "APRIL FINE PAPER TRADING"
    },
    "consignee": {
      "present": true,
      "label_seen": "Consignee (Non-Negotiable)",
      "raw": "MOORIM SP CO., LTD"
    },
    "notify_party": {
      "present": true,
      "label_seen": "Notify",
      "raw": "MOORIM SP CO., LTD"
    },
    "port_of_loading": {
      "present": true,
      "label_seen": "Port of Loading (POL)",
      "raw": "NANTONG, CHINA"
    },
    "port_of_discharge": {
      "present": false,
      "label_seen": "PORT OF DISCHARGE",
      "raw": "N/A"
    },
    "container_count": {
      "present": true,
      "label_seen": "No. of Containers or Packages",
      "raw": "6 x 20'GP"
    },
    "gross_weight_kg": {
      "present": false,
      "label_seen": "GROSS WEIGHT",
      "raw": "____MT"
    }
  }
}