{
  "email_id": "email_051",
  "declared_role": "BL",
  "source_path": "attachments/email_051_BL.txt",
  "format": "txt",
  "detected_doc_type": "BL",
  "parse_status": "ok",
  "fields": {
    "shipper": {
      "present": true,
      "label_seen": "Shipper/Exporter",
      "raw": "ASIA PACIFIC PAPERBOARD TRADING PTE LTD"
    },
    "consignee": {
      "present": true,
      "label_seen": "To the Order of",
      "raw": "KPP-ANTALIS (SINGAPORE) PTE. LTD."
    },
    "notify_party": {
      "present": true,
      "label_seen": "Notify",
      "raw": "KPP-ANTALIS (SINGAPORE) PTE. LTD."
    },
    "port_of_loading": {
      "present": true,
      "label_seen": "Port of Loading",
      "raw": "NHAVA SHEVA, INDIA (INNSA)"
    },
    "port_of_discharge": {
      "present": true,
      "label_seen": "POD",
      "raw": "SAVANNAH, US (USSAV)"
    },
    "container_count": {
      "present": true,
      "label_seen": "Container Count",
      "raw": "3 x 20'FCL"
    },
    "gross_weight_kg": {
      "present": true,
      "label_seen": "Gross Wt (kgs)",
      "raw": "60,645 KG"
    }
  }
}