{
  "email_id": "email_302",
  "declared_role": "SI",
  "source_path": "attachments/email_302_SI.xlsx",
  "format": "xlsx",
  "detected_doc_type": "SI",
  "parse_status": "ok",
  "fields": {
    "shipper": {
      "present": true,
      "label_seen": "Shipper",
      "raw": "APRIL FINE PAPER TRADING (MIDDLE EAST) FZE"
    },
    "consignee": {
      "present": true,
      "label_seen": "CONSIGNEE",
      "raw": "INTERNATIONAL FOREST PRODUCTS LLC"
    },
    "notify_party": {
      "present": true,
      "label_seen": "NOTIFY PARTY",
      "raw": "KTP CO., LTD"
    },
    "port_of_loading": {
      "present": true,
      "label_seen": "Port of Loading (POL)",
      "raw": "RUGAO/NANTONG/SHANGHAI, CHINA"
    },
    "port_of_discharge": {
      "present": true,
      "label_seen": "PORT OF DISCHARGE",
      "raw": "BRISBANE, AUSTRALIA"
    },
    "container_count": {
      "present": true,
      "label_seen": "Total Containers",
      "raw": "2 x 20'GP"
    },
    "gross_weight_kg": {
      "present": true,
      "label_seen": "GROSS WEIGHT",
      "raw": "40176"
    }
  }
}