{
  "email_id": "email_313",
  "declared_role": "BL",
  "source_path": "attachments/email_313_BL.pdf",
  "format": "pdf",
  "detected_doc_type": "BL",
  "parse_status": "ok",
  "fields": {
    "shipper": {
      "present": true,
      "label_seen": "Shipper (Principal or Seller)",
      "raw": "APRIL FINE PAPER TRADING"
    },
    "consignee": {
      "present": true,
      "label_seen": "Consignee",
      "raw": "KPP-ANTALIS (SINGAPORE) PTE. LTD."
    },
    "notify_party": {
      "present": true,
      "label_seen": "NOTIFY PARTY",
      "raw": "KPP-ANTALIS (SINGAPORE) PTE. LTD."
    },
    "port_of_loading": {
      "present": true,
      "label_seen": "POL",
      "raw": "RUGAO/NANTONG/SHANGHAI, CHINA"
    },
    "port_of_discharge": {
      "present": true,
      "label_seen": "PORT OF DISCHARGE",
      "raw": "HOCHIMINH CITY, VIETNAM"
    },
    "container_count": {
      "present": true,
      "label_seen": "Total Containers",
      "raw": "4 x 40'HC"
    },
    "gross_weight_kg": {
      "present": true,
      "label_seen": "TOTAL Gross Weight■■(KGS)",
      "raw": "117,770 KG"
    }
  }
}