{
  "email_id": "email_056",
  "declared_role": "SI",
  "source_path": "attachments/email_056_SI.txt",
  "format": "txt",
  "detected_doc_type": "SI",
  "parse_status": "ok",
  "fields": {
    "shipper": {
      "present": true,
      "label_seen": "Shipper/Exporter",
      "raw": "APRIL FAR EAST (M) SDN BHD"
    },
    "consignee": {
      "present": true,
      "label_seen": "Consignee",
      "raw": "MOORIM SP CO., LTD"
    },
    "notify_party": {
      "present": true,
      "label_seen": "NOTIFY PARTY",
      "raw": "MOORIM SP CO., LTD"
    },
    "port_of_loading": {
      "present": true,
      "label_seen": "POL",
      "raw": "NANTONG, CHINA (CNNTG)"
    },
    "port_of_discharge": {
      "present": true,
      "label_seen": "Port of Discharge (POD)",
      "raw": "KARACHI, PAKISTAN (PKKHI)"
    },
    "container_count": {
      "present": true,
      "label_seen": "Total Containers",
      "raw": "1 x 20'GP"
    },
    "gross_weight_kg": {
      "present": true,
      "label_seen": "Gross Weight (KG)",
      "raw": "20,131 KG"
    }
  }
}