{
  "email_id": "email_143",
  "declared_role": "BL",
  "source_path": "attachments/email_143_BL.txt",
  "format": "txt",
  "detected_doc_type": "BL",
  "parse_status": "ok",
  "fields": {
    "shipper": {
      "present": true,
      "label_seen": "SHIPPER",
      "raw": "ASIA PACIFIC PAPERBOARD TRADING PTE LTD"
    },
    "consignee": {
      "present": true,
      "label_seen": "Consignee (Non-Negotiable)",
      "raw": "SAFQA LIMITED"
    },
    "notify_party": {
      "present": true,
      "label_seen": "Notify",
      "raw": "SAFQA LIMITED"
    },
    "port_of_loading": {
      "present": true,
      "label_seen": "POL",
      "raw": "RUGAO/NANTONG/SHANGHAI, CHINA (CNSHA)"
    },
    "port_of_discharge": {
      "present": true,
      "label_seen": "POD",
      "raw": "GDANSK, POLAND (PLGDN)"
    },
    "container_count": {
      "present": true,
      "label_seen": "Total Containers",
      "raw": "2 x 20'FCL"
    },
    "gross_weight_kg": {
      "present": true,
      "label_seen": "Gross Weight毛重(KGS)",
      "raw": "42,486 KG"
    }
  }
}