{
  "email_id": "email_291",
  "declared_role": "SI",
  "source_path": "attachments/email_291_SI.xlsx",
  "format": "xlsx",
  "detected_doc_type": "SI",
  "parse_status": "ok",
  "fields": {
    "shipper": {
      "present": true,
      "label_seen": "SHIPPER",
      "raw": "APRIL FINE PAPER TRADING (MIDDLE EAST) FZE"
    },
    "consignee": {
      "present": true,
      "label_seen": "To the Order of",
      "raw": "INTERNATIONAL FOREST PRODUCTS LLC"
    },
    "notify_party": {
      "present": true,
      "label_seen": "Notify",
      "raw": "INTERNATIONAL FOREST PRODUCTS LLC"
    },
    "port_of_loading": {
      "present": true,
      "label_seen": "POL",
      "raw": "NANTONG, CHINA"
    },
    "port_of_discharge": {
      "present": true,
      "label_seen": "POD",
      "raw": "SAVANNAH, US"
    },
    "container_count": {
      "present": true,
      "label_seen": "Container Count",
      "raw": "1 x 20'GP"
    },
    "gross_weight_kg": {
      "present": true,
      "label_seen": "GROSS WEIGHT",
      "raw": "21745"
    }
  }
}