{
  "email_id": "email_496",
  "declared_role": "BL",
  "source_path": "attachments/email_496_BL.xlsx",
  "format": "xlsx",
  "detected_doc_type": "BL",
  "parse_status": "ok",
  "fields": {
    "shipper": {
      "present": true,
      "label_seen": "Shipper/Exporter",
      "raw": "APRIL FINE PAPER TRADING (MIDDLE EAST) FZE"
    },
    "consignee": {
      "present": true,
      "label_seen": "Consignee (Non-Negotiable)",
      "raw": "3S PAPER PRODUCTS SDN BHD"
    },
    "notify_party": {
      "present": true,
      "label_seen": "Notify Party/Intermediate Consignee",
      "raw": "3S PAPER PRODUCTS SDN BHD"
    },
    "port_of_loading": {
      "present": true,
      "label_seen": "POL",
      "raw": "NANTONG, CHINA"
    },
    "port_of_discharge": {
      "present": true,
      "label_seen": "Port of Discharge",
      "raw": "PYEONGTAEK, SOUTH KOREA"
    },
    "container_count": {
      "present": true,
      "label_seen": "No. of Containers or Packages",
      "raw": "15 x 20'GP"
    },
    "gross_weight_kg": {
      "present": true,
      "label_seen": "Gross Weight毛重(KGS)",
      "raw": "328665"
    }
  }
}