{
  "email_id": "email_043",
  "declared_role": "SI",
  "source_path": "attachments/email_043_SI.txt",
  "format": "txt",
  "detected_doc_type": "SI",
  "parse_status": "ok",
  "fields": {
    "shipper": {
      "present": true,
      "label_seen": "Shipper (Principal or Seller)",
      "raw": "ASIA PACIFIC PAPERBOARD TRADING PTE LTD"
    },
    "consignee": {
      "present": true,
      "label_seen": "CONSIGNEE",
      "raw": "PACIFIC OFFICE (M) SDN BHD"
    },
    "notify_party": {
      "present": true,
      "label_seen": "Notify Party",
      "raw": "PACIFIC OFFICE (M) SDN BHD"
    },
    "port_of_loading": {
      "present": true,
      "label_seen": "PORT OF LOADING",
      "raw": "NHAVA SHEVA, INDIA (INNSA)"
    },
    "port_of_discharge": {
      "present": true,
      "label_seen": "PORT OF DISCHARGE",
      "raw": "KLAIPEDA, LITHUANIA (LTKLJ)"
    },
    "container_count": {
      "present": true,
      "label_seen": "No. of Containers or Packages",
      "raw": "3 x 20'GP"
    },
    "gross_weight_kg": {
      "present": true,
      "label_seen": "Gross Weight毛重(KGS)",
      "raw": "68,649 KG"
    }
  }
}